{
  "schemaVersion": 1,
  "release": "1.4.0",
  "publishedAt": "2026-09-20T15:09:36Z",
  "gitRevision": "5ad86679927573b1617edb6aab0d077fd639f068",
  "images": {
    "server": "approxx/kubedok-server@sha256:3b99ffe006b7dbee18cdccce955c7133d88ff3029d512bb5c14d128e374d7450",
    "nginx": "approxx/kubedok-nginx@sha256:a112e5b58578357cdb8734ee288cf4d140c97dbd045d7bbc733d6086c434c3a8",
    "postgres": "approxx/kubedok-postgres@sha256:24af310097320dbecd4fda4478ef11104a7ddbc7dec69fbf77dfc39bd92adc7d",
    "agent": "approxx/kubedok-agent@sha256:0ba82cb940ab742f8a7ca7e63b151f724a13aa193f5ddf4aa1841ce59633f754"
  },
  "postgresMajor": 16,
  "minimumAgentVersion": "1.0.0",
  "minimumUpgradeFrom": "1.4.0",
  "notes": "https://github.com/glikaj/kubedok/releases/tag/v1.4.0"
}
