{
  "schemaVersion": 1,
  "release": "1.4.1",
  "publishedAt": "2026-09-21T09:56:12Z",
  "gitRevision": "6a5bdd88fe5e434a5a77034b0f9ae8ee926a9c7d",
  "images": {
    "server": "approxx/kubedok-server@sha256:d1704e044f79f46ec88a6c3bb2cdffe8a4709ae23ef6ae3a7c2fa46021e28e5a",
    "nginx": "approxx/kubedok-nginx@sha256:3335dbbe633bc75146cacd0ffcdd40ef72083be8b22549daff85959df2a5fdaa",
    "postgres": "approxx/kubedok-postgres@sha256:3efde6ed058f6a84ef3191b305c31f278a3b458812a5150c8bac41338c5a7d28",
    "agent": "approxx/kubedok-agent@sha256:5431535556f5c000453799304e4dd8bbbef6c8a249a10957b50b0e7d88a5a348"
  },
  "postgresMajor": 16,
  "minimumAgentVersion": "1.0.0",
  "minimumUpgradeFrom": "1.4.0",
  "notes": "https://github.com/glikaj/kubedok/releases/tag/v1.4.1"
}
