{
  "schemaVersion": 1,
  "release": "1.4.2",
  "publishedAt": "2026-09-21T11:12:31Z",
  "gitRevision": "aa6803a5ebbefdab88a89c2592124026d97c8341",
  "images": {
    "server": "approxx/kubedok-server@sha256:f5a3637f46815fb1db50805788e8416cecf269f24788e7fdca087ee8aa66754c",
    "nginx": "approxx/kubedok-nginx@sha256:06611bf51b43a4188649ae39372a5e375b20dcf409b34f9f1e0baecdb1ea98e2",
    "postgres": "approxx/kubedok-postgres@sha256:72b56c3b2b514d1a32d6b99a667e8c4d000346898edf9c784bc617440a254d7d",
    "agent": "approxx/kubedok-agent@sha256:559f24d94acbb7873f9679aca8b0fd31ed9da385c644012235ac80cb01285937"
  },
  "postgresMajor": 16,
  "minimumAgentVersion": "1.0.0",
  "minimumUpgradeFrom": "1.4.0",
  "notes": "https://github.com/glikaj/kubedok/releases/tag/v1.4.2"
}
