{
  "schemaVersion": 1,
  "release": "1.4.3",
  "publishedAt": "2026-09-26T14:24:48Z",
  "gitRevision": "3d21a5d3579d5ae0384e0af0887d947fc614d643",
  "images": {
    "server": "approxx/kubedok-server@sha256:1c4000902521b0d573cc1ae1709adb4396427899492fcc00466bb358283af71b",
    "nginx": "approxx/kubedok-nginx@sha256:6401c6ed162eb78f0a3bbe42053abdcd4247912b7b6c6bec73e3dbd745ea1c80",
    "postgres": "approxx/kubedok-postgres@sha256:fb413c431a78b022865b85d8e42a2fe4f6606aed775240ead5ffc0058df96a1a",
    "agent": "approxx/kubedok-agent@sha256:a2ffd470bbfebc88f20442640b8f682f780c8a6331d24ffcda5937b5014a5a6b"
  },
  "postgresMajor": 16,
  "minimumAgentVersion": "1.0.0",
  "minimumUpgradeFrom": "1.4.0",
  "notes": "https://github.com/glikaj/kubedok/releases/tag/v1.4.3"
}
